[
    {
        "countryCode": "AD",
        "destination": "Andorra",
        "letterPost": {
            "air": "acceptable",
            "sal": "not_acceptable",
            "surface": "acceptable"
        },
        "parcels": {
            "air": "acceptable",
            "sal": "not_acceptable",
            "surface": "acceptable"
        },
        "ems": "acceptable",
        "restrictions": {
            "normal": [],
            "temporary": [],
            "delays": []
        },
        "notification": ""
    },
    {
        "countryCode": "AE",
        "destination": "United Arab Emirates",
        "letterPost": {
            "air": "acceptable",
            "sal": "not_acceptable",
            "surface": "acceptable"
        },
        "parcels": {
            "air": "acceptable",
            "sal": "not_acceptable",
            "surface": "acceptable"
        },
        "ems": "acceptable",
        "restrictions": {
            "normal": [],
            "temporary": [],
            "delays": []
        },
        "notification": ""
    },
    {
        "countryCode": "AF",
        "destination": "Afghanistan",
        "letterPost": {
            "air": "acceptable",
            "sal": "no_service",
            "surface": "not_acceptable"
        },
        "parcels": {
            "air": "acceptable",
            "sal": "no_service",
            "surface": "not_acceptable"
        },
        "ems": "no_service",
        "restrictions": {
            "normal": [],
            "temporary": [],
            "delays": []
        },
        "notification": ""
    },
    {
        "countryCode": "AG",
        "destination": "Antigua and Barbuda",
        "letterPost": {
            "air": "acceptable",
            "sal": "no_service",
            "surface": "not_acceptable"
        },
        "parcels": {
            "air": "acceptable",
            "sal": "no_service",
            "surface": "not_acceptable"
        },
        "ems": "no_service",
        "restrictions": {
            "normal": [],
            "temporary": [],
            "delays": []
        },
        "notification": ""
    },
    {
        "countryCode": "AI",
        "destination": "Anguilla",
        "letterPost": {
            "air": "not_acceptable",
            "sal": "no_service",
            "surface": "not_acceptable"
        },
        "parcels": {
            "air": "not_acceptable",
            "sal": "no_service",
            "surface": "not_acceptable"
        },
        "ems": "no_service",
        "restrictions": {
            "normal": [],
            "temporary": [],
            "delays": []
        },
        "notification": ""
    },
    {
        "countryCode": "AL",
        "destination": "Albania",
        "letterPost": {
            "air": "acceptable",
            "sal": "no_service",
            "surface": "acceptable"
        },
        "parcels": {
            "air": "acceptable",
            "sal": "no_service",
            "surface": "acceptable"
        },
        "ems": "no_service",
        "restrictions": {
            "normal": [],
            "temporary": [],
            "delays": []
        },
        "notification": ""
    },
    {
        "countryCode": "AM",
        "destination": "Armenia",
        "letterPost": {
            "air": "acceptable",
            "sal": "not_acceptable",
            "surface": "not_acceptable"
        },
        "parcels": {
            "air": "acceptable",
            "sal": "not_acceptable",
            "surface": "not_acceptable"
        },
        "ems": "no_service",
        "restrictions": {
            "normal": [],
            "temporary": [],
            "delays": []
        },
        "notification": ""
    },
    {
        "countryCode": "AO",
        "destination": "Angola",
        "letterPost": {
            "air": "not_acceptable",
            "sal": "no_service",
            "surface": "not_acceptable"
        },
        "parcels": {
            "air": "not_acceptable",
            "sal": "no_service",
            "surface": "not_acceptable"
        },
        "ems": "no_service",
        "restrictions": {
            "normal": [],
            "temporary": [],
            "delays": []
        },
        "notification": ""
    },
    {
        "countryCode": "AR",
        "destination": "Argentina",
        "letterPost": {
            "air": "acceptable",
            "sal": "not_acceptable",
            "surface": "not_acceptable"
        },
        "parcels": {
            "air": "acceptable",
            "sal": "not_acceptable",
            "surface": "not_acceptable"
        },
        "ems": "acceptable",
        "restrictions": {
            "normal": [],
            "temporary": [],
            "delays": []
        },
        "notification": ""
    },
    {
        "countryCode": "AS",
        "destination": "American Samoa",
        "letterPost": {
            "air": "acceptable",
            "sal": "not_acceptable",
            "surface": "acceptable"
        },
        "parcels": {
            "air": "acceptable",
            "sal": "not_acceptable",
            "surface": "acceptable"
        },
        "ems": "no_service",
        "restrictions": {
            "normal": [],
            "temporary": [],
            "delays": []
        },
        "notification": ""
    },
    {
        "countryCode": "AT",
        "destination": "Austria",
        "letterPost": {
            "air": "acceptable",
            "sal": "not_acceptable",
            "surface": "acceptable"
        },
        "parcels": {
            "air": "acceptable",
            "sal": "not_acceptable",
            "surface": "acceptable"
        },
        "ems": "acceptable",
        "restrictions": {
            "normal": [],
            "temporary": [],
            "delays": []
        },
        "notification": ""
    },
    {
        "countryCode": "AU",
        "destination": "Australia",
        "letterPost": {
            "air": "acceptable",
            "sal": "not_acceptable",
            "surface": "acceptable"
        },
        "parcels": {
            "air": "acceptable",
            "sal": "not_acceptable",
            "surface": "acceptable"
        },
        "ems": "acceptable",
        "restrictions": {
            "normal": [],
            "temporary": [],
            "delays": []
        },
        "notification": ""
    },
    {
        "countryCode": "AW",
        "destination": "Aruba",
        "letterPost": {
            "air": "acceptable",
            "sal": "no_service",
            "surface": "acceptable"
        },
        "parcels": {
            "air": "acceptable",
            "sal": "no_service",
            "surface": "acceptable"
        },
        "ems": "no_service",
        "restrictions": {
            "normal": [],
            "temporary": [],
            "delays": []
        },
        "notification": ""
    },
    {
        "countryCode": "AX",
        "destination": "Ascension",
        "letterPost": {
            "air": "acceptable",
            "sal": "no_service",
            "surface": "not_acceptable"
        },
        "parcels": {
            "air": "acceptable",
            "sal": "no_service",
            "surface": "not_acceptable"
        },
        "ems": "no_service",
        "restrictions": {
            "normal": [],
            "temporary": [],
            "delays": []
        },
        "notification": ""
    },
    {
        "countryCode": "AZ",
        "destination": "Azerbaijan",
        "letterPost": {
            "air": "acceptable",
            "sal": "not_acceptable",
            "surface": "not_acceptable"
        },
        "parcels": {
            "air": "acceptable",
            "sal": "not_acceptable",
            "surface": "not_acceptable"
        },
        "ems": "acceptable",
        "restrictions": {
            "normal": [],
            "temporary": [],
            "delays": []
        },
        "notification": ""
    },
    {
        "countryCode": "BA",
        "destination": "Bosnia and Herzegovina",
        "letterPost": {
            "air": "acceptable",
            "sal": "no_service",
            "surface": "acceptable"
        },
        "parcels": {
            "air": "acceptable",
            "sal": "no_service",
            "surface": "acceptable"
        },
        "ems": "no_service",
        "restrictions": {
            "normal": [],
            "temporary": [],
            "delays": []
        },
        "notification": ""
    },
    {
        "countryCode": "BB",
        "destination": "Barbados",
        "letterPost": {
            "air": "acceptable",
            "sal": "no_service",
            "surface": "not_acceptable"
        },
        "parcels": {
            "air": "acceptable",
            "sal": "no_service",
            "surface": "not_acceptable"
        },
        "ems": "acceptable",
        "restrictions": {
            "normal": [],
            "temporary": [],
            "delays": []
        },
        "notification": ""
    },
    {
        "countryCode": "BD",
        "destination": "Bangladesh",
        "letterPost": {
            "air": "acceptable",
            "sal": "not_acceptable",
            "surface": "not_acceptable"
        },
        "parcels": {
            "air": "acceptable",
            "sal": "not_acceptable",
            "surface": "not_acceptable"
        },
        "ems": "acceptable",
        "restrictions": {
            "normal": [],
            "temporary": [],
            "delays": []
        },
        "notification": ""
    },
    {
        "countryCode": "BE",
        "destination": "Belgium",
        "letterPost": {
            "air": "acceptable",
            "sal": "not_acceptable",
            "surface": "acceptable"
        },
        "parcels": {
            "air": "acceptable",
            "sal": "not_acceptable",
            "surface": "acceptable"
        },
        "ems": "acceptable",
        "restrictions": {